{
  "base_commit": "0b97ae1b69396cec3a17106c12d11ca27a8b95da",
  "branch": "claude/musing-dijkstra-a7c360",
  "classification_input_sha256": "5372c6d3a57a2152e36869c46002d006056806486bb79849e171a05c41355afb",
  "content": {
    "acceptance_conditions": [
      "1. `git check-attr text eol -- .ai/tasks/TASK-0028/evidence-h1-b7c7fb4a.json` 报告 `text: set`、`eol: lf`；",
      "对上述两个被摘要的路径均如此。",
      "2. `git check-attr text -- <6 个 .coverage>` 全部报告 `text: unset`。",
      "3. 先提交 `.gitattributes` 与本任务账本，再执行 `git add --renormalize .`，其后",
      "`git diff --cached --stat` **完全为空**——没有任何 blob 被改写。（先提交是为了让这条检查无歧义：",
      "否则本任务自身的改动也会出现在 staged diff 里。）",
      "4. 用 `git rm --cached -r . && git reset --hard` 按新规则重新检出后，",
      "`git ls-files --eol .ai/tasks` 中不再出现 `w/crlf`。",
      "注意：`--renormalize` 只修索引，不会刷新工作区，必须重新检出才能让 Windows 上的既有工作副本生效。",
      "5. 在 Windows（`core.autocrlf=true`）上",
      "`uv run --locked python -m pytest tests/integration/test_acceptance_traceability.py -q` 全部通过，",
      "特别是 `test_phase_two_historical_hashes_and_current_subject_match_records`。",
      "6. 在 Windows 上 `uv run --locked python -m pytest -q` 全量通过，且与改动前相比不新增任何失败。",
      "7. `git status --porcelain` 中不出现 `.coverage` 被修改。",
      "8. 最终 diff 只含 `.gitattributes`。"
    ],
    "code_map": {
      "allowed_scope": [
        ".gitattributes"
      ],
      "changed_paths": [
        ".ai/tasks/TASK-0042/approvals.json",
        ".ai/tasks/TASK-0042/classification.json",
        ".ai/tasks/TASK-0042/events.jsonl",
        ".ai/tasks/TASK-0042/review-contexts/08f2768241c9fdff8c43322f1fcc867e0f0c72bff2367e90a70c4405a0a36a7c.json",
        ".ai/tasks/TASK-0042/reviews/REV-0001-r0001.json",
        ".ai/tasks/TASK-0042/spec.md",
        ".ai/tasks/TASK-0042/task.yaml",
        ".gitattributes"
      ]
    },
    "diff_summary": {
      "additions": 340,
      "binary_files": 0,
      "deletions": 1,
      "files": 8
    },
    "frozen_spec": "# Task Specification\n\n## 目标\n\n在 `.gitattributes` 中把 `.ai/tasks/**` 整体钉为 `text eol=lf`（并把 6 个二进制 `.coverage` 显式标记为 `binary`），使\n`tests/integration/test_acceptance_traceability.py::test_phase_two_historical_hashes_and_current_subject_match_records`\n在 `core.autocrlf=true` 的 Windows 检出上通过，且不改写任何已提交 blob。\n\n## 背景与根因\n\n`.gitattributes` 当前只有一条规则：\n\n    .ai/tasks/*/historical-snapshots/** text eol=lf\n\n该规则是为 `tests/e2e/test_phase_02_self_hosting_scenario.py` 按字节校验\n`.ai/tasks/TASK-0025/historical-snapshots/h1-fe30565` 下的 bundle 而加的，但它没有覆盖 `.ai/tasks/` 下其余任务证据文件。\n`test_acceptance_traceability.py:237` 对该 glob 之外的两个路径做 `read_bytes()` 摘要：\n\n- `.ai/tasks/TASK-0028/evidence-h1-b7c7fb4a.json`\n- `.ai/tasks/TASK-0028/action-use-5a3071cd2e446dea89d5b8acb5c6c26399cf69a4ba141da0f3995706bfa28020.md`\n\n在 `core.autocrlf=true` 的 Windows 上这两个文件以 CRLF 检出，工作副本摘要与测试钉住的 LF 摘要不符。已实测：\n\n| 路径 | blob (`git cat-file blob HEAD:…`) | 工作副本 |\n| --- | --- | --- |\n| `evidence-h1-b7c7fb4a.json` | `4fc5729e…823662`（= 测试期望值） | `476ac2e1…843b2516` |\n| `action-use-5a3071cd…8020.md` | `3d420bb8…6eff94`（= 测试期望值） | `970fbe2b…079b52` |\n\n**测试钉住的摘要是正确的**（等于 blob 摘要），错的是检出规则不完整。Linux/LF 的 CI 因此通过。\n\n现状实测（`git ls-files --eol .ai`，共 1027 个跟踪文件）：\n\n- 940 个 `i/lf w/crlf attr/`（无属性、被 autocrlf 转成 CRLF）— 缺口所在\n- 21 个 `i/lf w/lf attr/text`（已被现有 historical-snapshots 规则覆盖）\n- 60 个 `i/none w/none`（空文件）\n- 6 个 `i/-text w/-text`（Git 自动判定为二进制）\n\n## 范围\n\n只修改 `.gitattributes`，新增两条规则：\n\n1. `.ai/tasks/** text eol=lf` — 覆盖全部任务账本与证据文件。\n2. `.ai/tasks/**/.coverage binary` — 6 个 coverage SQLite 文件必须保持二进制，排在其后以覆盖前一条。\n\n不修改任何测试、任何期望摘要、任何 `.ai/tasks/` 下的内容。\n\n## 关键安全依据：不会改写任何已提交 blob\n\n已逐个校验 `.ai` 下全部 1027 个索引 blob 的字节：**只有 6 个 blob 含 CR，且全部是 `.coverage`**：\n\n    .ai/tasks/TASK-0001/logs/run-20260821T113252388253Z/.coverage\n    .ai/tasks/TASK-0002/logs/run-20260821T114956613507Z/.coverage\n    .ai/tasks/TASK-0002/logs/run-20260821T120144843557Z/.coverage\n    .ai/tasks/TASK-0003/logs/run-20260821T122553379824Z/.coverage\n    .ai/tasks/TASK-0004/logs/run-20260822T121808322845Z/.coverage\n    .ai/tasks/TASK-0004/logs/run-20260822T123218334873Z/.coverage\n\n其余 987 个 blob 已经是纯 LF。`text eol=lf` 只规定「索引 LF、工作区 LF」，因此对这 987 个 blob，\n`git add --renormalize` 是恒等操作，不可能产生新的 blob。6 个 `.coverage` 由第 2 条规则钉为 `binary`\n（= `-text -diff -merge`），与它们当前被自动判定的 `-text` 行为一致，同样不被重写。\n\n这满足任务账本「追加式、不得重写」的治理要求。\n\n## 非目标\n\n- 不覆盖 `.ai/tasks/` 之外的 `.ai/**`（`.ai/policy/**`、`.ai/schemas/**`、`.ai/templates/**`、\n  `.ai/mutations/**`、`.ai/repository-id`，共 34 个文件）。已核查：没有任何测试对它们钉住跨平台字节摘要——\n  `test_mutation_runner_contract.py`、`test_gate_parity.py`、`test_observation_parity.py` 都是\n  「同一次运行内 before == after」的自洽校验，与行尾无关；`test_contracts.py` 对 `.ai/repository-id`\n  用 `splitlines()`，CRLF 下同样成立。且 `.ai/policy/**` 与 `.ai/schemas/**` 本身在升级清单上，\n  纳入会无谓扩大本决策单元的风险面（AGENTS.md 规则 8）。\n- 不改动 `core.autocrlf`、不改动仓库或用户的 Git 配置。\n- 不修改任何测试代码或期望摘要。\n- 不为 `.ai/tasks/` 之外的其他目录（`docs/`、`tests/`、`src/`）新增行尾规则。\n\n## 验收条件\n\n1. `git check-attr text eol -- .ai/tasks/TASK-0028/evidence-h1-b7c7fb4a.json` 报告 `text: set`、`eol: lf`；\n   对上述两个被摘要的路径均如此。\n2. `git check-attr text -- <6 个 .coverage>` 全部报告 `text: unset`。\n3. 先提交 `.gitattributes` 与本任务账本，再执行 `git add --renormalize .`，其后\n   `git diff --cached --stat` **完全为空**——没有任何 blob 被改写。（先提交是为了让这条检查无歧义：\n   否则本任务自身的改动也会出现在 staged diff 里。）\n4. 用 `git rm --cached -r . && git reset --hard` 按新规则重新检出后，\n   `git ls-files --eol .ai/tasks` 中不再出现 `w/crlf`。\n   注意：`--renormalize` 只修索引，不会刷新工作区，必须重新检出才能让 Windows 上的既有工作副本生效。\n5. 在 Windows（`core.autocrlf=true`）上\n   `uv run --locked python -m pytest tests/integration/test_acceptance_traceability.py -q` 全部通过，\n   特别是 `test_phase_two_historical_hashes_and_current_subject_match_records`。\n6. 在 Windows 上 `uv run --locked python -m pytest -q` 全量通过，且与改动前相比不新增任何失败。\n7. `git status --porcelain` 中不出现 `.coverage` 被修改。\n8. 最终 diff 只含 `.gitattributes`。\n\n## 验证等级\n\n验证等级为 **V2**，四项 V2 要求全部声明为 `true`，`permission_requirements` 含 `action_approval`。\n\n首次分类时我只声明了 `acceptance_required` 与 `integration_required`，未声明\n`targeted_mutation_required`，造成不可满足的组合：V2 的检查计划无条件包含 `targeted_mutation`，\n而 `mutation_evidence` 加载器只在决策单元同时满足\n`verification_requirements.targeted_mutation_required is True` 且 `permission_requirements` 含\n`action_approval`、并存在人类版本绑定的单次 action 批准时才接受该检查。第一次 V2 运行因此在\n14 项中通过 13 项，`targeted_mutation` 以 `ACTION_APPROVAL_REQUIRED` 失败。\n\n项目所有者的处置：维持 V2，并明确批准 `targeted_mutation` 的 action。据此把四项要求补齐为 `true`、\n补上 `action_approval` 权限，重新分类并重新取得 spec 批准，再以版本绑定的单次 action 批准执行\n`.ai/mutations/phase-02-critical-manifest.json` 的 `MUT-V2-001..005` 重放。\n\n`targeted_mutation` 变异的是 `src/aiflow/**`，本变更不含源码改动；该证据用于满足 V2 的固定闸口，\n不构成对 `.gitattributes` 改动本身的额外证明。对本修复起决定作用的证据是 `regression_tests`\n（`pytest -q` 全量，含 `tests/integration/test_acceptance_traceability.py`）与 `integration`。\n\n执行环境要求：`aiflow verify` 必须以 `uv run --locked` 启动，使 `sys.executable` 指向本工作树\n`.venv`。首次运行使用系统 Python，其中的 `aiflow` 是指向主检出的过期 editable 安装（0.1.0，\n本工作树声明 0.2.0），导致 `test_cli.py::test_package_metadata_matches_runtime_version` 等失败——\n与本变更无关的环境问题。\n\n## 禁止动作\n\n`push`、`merge`、`deploy`、`delete`、`secret_export`、`paid_external_call`。\n另：不得修改测试期望摘要，不得重写任何已提交 blob，不得改动 `.ai/tasks/` 下的任何文件内容。\n\n## 错误行为\n\n- 若 `git add --renormalize .` 产生任何 staged 改动，说明存在含 CR 的文本 blob 会被重写：立即\n  `git reset` 撤销暂存，停止并升级，不得提交。\n- 若任何 `.coverage` 在检出或 renormalize 后发生变化，说明二进制豁免未生效：停止并升级。\n- 若全量测试在改动后出现改动前不存在的失败：停止并升级，不得通过修改测试掩盖。\n\n## 回滚\n\n改动完全可逆：还原 `.gitattributes` 的新增行，再用 `git rm --cached -r . && git reset --hard`\n重新检出即可恢复原有行尾。因为全程不产生任何 blob 改写，回滚不涉及历史重写，也不触及任务账本内容。\n",
    "goal": "修复 .gitattributes 的 checkout 归一化缺口：现有规则只覆盖 .ai/tasks/*/historical-snapshots/**，导致 .ai/tasks/ 下其余任务证据文件在 core.autocrlf=true 的 Windows 检出为 CRLF，使按字节摘要校验的测试（tests/integration/test_acceptance_traceability.py::test_phase_two_historical_hashes_and_current_subject_match_records）在 Windows 必然失败。将 .ai/tasks/** 整体钉为 text eol=lf，并把 6 个二进制 .coverage 文件显式标记为 binary 以免被误当文本。不修改任何测试的期望摘要，不改写任何已提交 blob",
    "known_limitations": [
      "Acceptance, integration, and targeted mutation execution are owned by Chapter 11."
    ],
    "reproduce_command": [
      "python",
      "-m",
      "aiflow",
      "verify",
      "TASK-0042",
      "--actor",
      "<verifier>"
    ]
  },
  "context_sha256": "c1b0bc9561300663f8306d5971a261637c2a0e9ac754cb26fd7afc07fcb52868",
  "decision_unit_ids": [
    "DU-001"
  ],
  "policy_sha256": "1f684f4bf4bd2e3c28b7a04903628790f7be40f88a1dbf54587b09b90230267f",
  "repository_id": "b85e5a53-4935-4436-bdbc-c26a241bfae8",
  "schema_version": "1.0",
  "spec_sha256": "fd7825d08a0720e93a67705de619ece53cc2c547be247de8243482152640a3f8",
  "subject_commit": "91563b1fc68497ed42c6ff03bbeaaea144004ccc",
  "task_id": "TASK-0042"
}
